{
  "$schema": "http://json-schema.org/draft-07/schema#",
  "type": "array",
  "items": {
    "type": "object",
    "additionalProperties": false,
    "required": [
      "key",
      "type",
      "status",
      "join_base",
      "subid_params"
    ],
    "properties": {
      "key": { "type": "string", "minLength": 1 },
      "type": { "type": "string", "enum": ["model_ref", "creator_ref", "video_merch"] },
      "status": {
        "type": "string",
        "enum": ["approved", "apply", "blocked", "low_prio", "research", "creator", "separate", "pending", "low_priority"]
      },
      "join_base": {
        "type": "string",
        "pattern": "^(?:https?:\\/\\/[^\\s]+)?$",
        "description": "Base join URL; leave blank while onboarding is gated."
      },
      "subid_params": {
        "type": "array",
        "items": { "type": "string", "minLength": 1 }
      }
    }
  }
}
