[
  {"key":"camsoda","type":"model_ref","status":"approved","join_base":"https://www.camsoda.com/models?id=naughtycamboss","subid_params":["subid"]},
  {"key":"chaturbate","type":"model_ref","status":"approved","join_base":"https://chaturbate.com/in/?tour=5zjT&campaign=YIOhf&track=default","subid_params":["track"]},
  {"key":"bonga","type":"model_ref","status":"approved","join_base":"https://bongacash.com/model-ref?c=828873","subid_params":["s1"]},
  {"key":"jasmin","type":"model_ref","status":"apply","join_base":"","subid_params":[]},
  {"key":"stripchat","type":"model_ref","status":"blocked","join_base":"","subid_params":[]},
  {"key":"myclub","type":"model_ref","status":"low_prio","join_base":"","subid_params":[]},
  {"key":"pornhub","type":"model_ref","status":"research","join_base":"","subid_params":[]},
  {"key":"onlyfans","type":"creator_ref","status":"creator","join_base":"","subid_params":[]},
  {"key":"manyvids","type":"video_merch","status":"separate","join_base":"","subid_params":[]}
]
